{
  "$schema": "../../check.schema.json",
  "description": "flow narrowing: $match case and else arms",
  "comment": "End-to-end forms of the $match-subject fact-map rows in typescript/test/check/narrowing.test.ts: a case arm pins the matched literal, the else arm excludes the handled literals, discriminant-path subjects refine the base union, and dynamic subjects derive no fact.",
  "builtins": "none",
  "cases": [
    {
      "description": "a bare-var case pins the matched literal",
      "module": {
        "f": {
          "$params": [{ "$param": "color", "$type": { "enum": ["w", "b"] } }],
          "$returns": { "const": "w" },
          "$return": {
            "$match": { "$var": "color" },
            "$cases": [["w", { "$var": "color" }]],
            "$else": "w"
          }
        }
      },
      "expected": { "diagnostics": [] }
    },
    {
      "description": "the else arm excludes the handled case literal",
      "module": {
        "f": {
          "$params": [{ "$param": "color", "$type": { "enum": ["w", "b"] } }],
          "$returns": { "const": "b" },
          "$return": {
            "$match": { "$var": "color" },
            "$cases": [["w", "b"]],
            "$else": { "$var": "color" }
          }
        }
      },
      "expected": { "diagnostics": [] }
    },
    {
      "description": "a null case pins null in its arm",
      "module": {
        "f": {
          "$params": [
            { "$param": "x", "$type": { "anyOf": [{ "type": "integer" }, { "type": "null" }] } }
          ],
          "$returns": { "type": "null" },
          "$return": {
            "$match": { "$var": "x" },
            "$cases": [[null, { "$var": "x" }]],
            "$else": null
          }
        }
      },
      "expected": { "diagnostics": [] }
    },
    {
      "description": "a null case leaves the non-null arm for else",
      "module": {
        "f": {
          "$params": [
            { "$param": "x", "$type": { "anyOf": [{ "type": "integer" }, { "type": "null" }] } }
          ],
          "$returns": { "type": "integer" },
          "$return": { "$match": { "$var": "x" }, "$cases": [[null, 0]], "$else": { "$var": "x" } }
        }
      },
      "expected": { "diagnostics": [] }
    },
    {
      "description": "a discriminant-path case narrows the base to the matching arm",
      "module": {
        "f": {
          "$params": [
            {
              "$param": "s",
              "$type": {
                "anyOf": [
                  {
                    "type": "object",
                    "properties": { "tag": { "const": "a" }, "r": { "type": "integer" } },
                    "required": ["tag", "r"],
                    "additionalProperties": false
                  },
                  {
                    "type": "object",
                    "properties": { "tag": { "const": "b" }, "side": { "type": "string" } },
                    "required": ["tag", "side"],
                    "additionalProperties": false
                  }
                ]
              }
            }
          ],
          "$returns": { "type": "integer" },
          "$return": {
            "$match": { "$get": "tag", "$from": { "$var": "s" } },
            "$cases": [
              ["a", { "$get": "r", "$from": { "$var": "s" } }],
              ["b", 0]
            ]
          }
        }
      },
      "expected": { "diagnostics": [] }
    },
    {
      "description": "a discriminant-path else arm drops the matched arm",
      "module": {
        "f": {
          "$params": [
            {
              "$param": "s",
              "$type": {
                "anyOf": [
                  {
                    "type": "object",
                    "properties": { "tag": { "const": "a" }, "r": { "type": "integer" } },
                    "required": ["tag", "r"],
                    "additionalProperties": false
                  },
                  {
                    "type": "object",
                    "properties": { "tag": { "const": "b" }, "side": { "type": "string" } },
                    "required": ["tag", "side"],
                    "additionalProperties": false
                  }
                ]
              }
            }
          ],
          "$returns": { "type": "string" },
          "$return": {
            "$match": { "$get": "tag", "$from": { "$var": "s" } },
            "$cases": [["a", ""]],
            "$else": { "$get": "side", "$from": { "$var": "s" } }
          }
        }
      },
      "expected": { "diagnostics": [] }
    },
    {
      "description": "a dynamic $match subject yields no fact",
      "comment": "The subject is a call result, so no path narrows: the case arm's nullable parameter keeps its declared union and fails the integer return.",
      "builtins": "standard",
      "module": {
        "f": {
          "$params": [
            { "$param": "x", "$type": { "anyOf": [{ "type": "integer" }, { "type": "null" }] } },
            { "$param": "xs", "$type": { "type": "array", "items": { "type": "integer" } } }
          ],
          "$returns": { "type": "integer" },
          "$return": {
            "$match": { "$call": "length", "$args": [{ "$var": "xs" }] },
            "$cases": [[0, { "$var": "x" }]],
            "$else": 0
          }
        }
      },
      "expected": {
        "diagnostics": [
          {
            "path": ["f", "$return", "$cases[0][1]"],
            "severity": "error",
            "messageIncludes": "not assignable",
            "expected": { "type": "integer" },
            "actual": { "anyOf": [{ "type": "integer" }, { "type": "null" }] }
          }
        ]
      }
    }
  ]
}
